{"type":"config","name":"Preset route load reliability","metricName":"load_score_ms","metricUnit":"ms","bestDirection":"lower"}
{"run":1,"commit":"0e92c4b","metric":138.55,"metrics":{"p95_ms":138.55,"mean_ms":79.897,"failures":0,"requests":124},"status":"keep","description":"Baseline: all built-in preset routes plus builtin-source sample under concurrency","timestamp":1786769819488,"segment":0,"confidence":null,"asi":{"hypothesis":"Establish broad route-level latency and reliability signal across the entire preset corpus before changing production code.","observed":"124 requests completed without failures; p95 is 138.55 ms and mean is 79.897 ms. Reliability needs mutation/stress coverage because steady-state baseline did not reproduce intermittent failures."}}
{"run":2,"commit":"0e92c4b","metric":152.958,"metrics":{"p95_ms":152.958,"mean_ms":76.231,"failures":0,"requests":124},"status":"discard","description":"Direct server-side disk lookup replaced SSR subrequest but regressed p95","timestamp":1786769869068,"segment":0,"confidence":null,"asi":{"hypothesis":"Removing the internal `/api/user-compositions` SSR fetch would reduce route overhead and remove a failure boundary.","observed":"Mean improved by 3.666 ms, but p95 regressed by 14.408 ms with no reliability difference in steady state.","rollback_reason":"Primary metric regressed; direct filesystem module added complexity without a p95 win.","next_action_hint":"Improve benchmark stability and isolate normal versus builtin-source timing before revisiting the subrequest boundary."}}
{"run":3,"commit":"0e92c4b","metric":162.338,"metrics":{"p95_ms":162.338,"mean_ms":73.833,"failures":0,"requests":124},"status":"discard","description":"Confirmation run of direct disk lookup showed repeat p95 regression","timestamp":1786769926411,"segment":0,"confidence":null,"asi":{"hypothesis":"The first direct-disk p95 regression might be benchmark noise because mean latency improved.","observed":"Second run again improved mean but regressed p95 more strongly, confirming filesystem completions create a worse latency tail under concurrency.","rollback_reason":"Repeated primary regression confirms this architecture is not suitable for the p95 target.","next_action_hint":"Keep SvelteKit internal fetch and optimize the absent-composition path or route observability instead."}}
{"run":4,"commit":"0e92c4b","metric":155.081,"metrics":{"p95_ms":155.081,"mean_ms":76.916,"normal_p95_ms":215.863,"builtin_p95_ms":67.575,"failures":0,"requests":124},"status":"discard","description":"Instrumented normal versus builtin-source p95 to localize route cost","timestamp":1786769972849,"segment":0,"confidence":null,"asi":{"hypothesis":"Splitting timings will show whether user-composition lookup dominates the preset route tail.","observed":"Normal-route p95 was 215.863 ms versus 67.575 ms for builtin-source requests, strongly localizing tail cost to user override lookup; overall variation also confirms a noisy benchmark.","rollback_reason":"No production improvement and the primary metric regressed; retain only autoresearch instrumentation.","next_action_hint":"Optimize the overwhelmingly common ENOENT path without replacing the internal fetch architecture."}}
{"run":5,"commit":"9130c4b","metric":118.717,"metrics":{"p95_ms":118.717,"mean_ms":71.718,"normal_p95_ms":120.023,"builtin_p95_ms":66.828,"failures":0,"requests":124},"status":"keep","description":"Indexed User composition filenames to skip absent-override subrequests","timestamp":1786770040807,"segment":0,"confidence":2.114392324093819,"asi":{"hypothesis":"Most built-in routes have no User override, so a process-local filename index can skip nested HTTP and filesystem work while API writes keep the index coherent.","observed":"Overall p95 improved 14.3% from baseline and normal-route p95 fell to 120.023 ms with zero failures; builtin-source timing stayed effectively flat.","correctness":"Focused user-composition tests and full svelte-check passed. POST/PUT add index entries only after successful writes; DELETE removes after successful unlink."}}
{"run":6,"commit":"9130c4b","metric":149.746,"metrics":{"p95_ms":149.746,"mean_ms":74.116,"normal_p95_ms":151.451,"builtin_p95_ms":65.584,"failures":0,"requests":124},"status":"discard","description":"Atomic User composition writes did not improve steady-state route score","timestamp":1786770101255,"segment":0,"confidence":2.6956167176350725,"asi":{"hypothesis":"Temp-file plus atomic rename would prevent readers seeing partial JSON during autosave, eliminating a plausible intermittent load failure.","observed":"Correctness checks passed, but the steady-state route workload contains no concurrent writes and p95 regressed; this benchmark cannot validate the reliability benefit.","rollback_reason":"Primary metric regressed and no measured failure was eliminated.","next_action_hint":"Use a dedicated concurrent read/write reliability phase before retrying atomic publication; idea recorded in .auto/ideas.md."}}
{"run":7,"commit":"9130c4b","metric":135.513,"metrics":{"p95_ms":135.513,"mean_ms":72.76,"normal_p95_ms":138.405,"builtin_p95_ms":65.769,"failures":0,"requests":124},"status":"discard","description":"Direct disk loading only for indexed existing overrides was slower than retained route","timestamp":1786770170756,"segment":0,"confidence":1.77143622722401,"asi":{"hypothesis":"After the index removes ENOENT reads, directly loading only known-present overrides should avoid nested traced requests without the prior filesystem tail.","observed":"This beat the original baseline slightly but was 16.796 ms slower than the retained indexed-subrequest result; normal p95 worsened to 138.405 ms.","rollback_reason":"Regressed against the best retained implementation.","next_action_hint":"Keep SvelteKit fetch for present overrides; target response parsing or repeated loads instead of direct disk I/O."}}
{"run":8,"commit":"9130c4b","metric":129.934,"metrics":{"p95_ms":129.934,"mean_ms":70.493,"normal_p95_ms":131.132,"builtin_p95_ms":67.203,"failures":0,"requests":124},"status":"discard","description":"Explicit Sentry capture for graceful preset load failures added observability but missed best p95","timestamp":1786770211736,"segment":0,"confidence":2.009117155447508,"asi":{"hypothesis":"Explicit captureException with bounded slug/source context would turn currently graceful 200 load failures into actionable Sentry issues without affecting success requests.","observed":"Checks passed and the design is optional-DSN safe, but the run was 11.217 ms slower than the retained best despite improving on original baseline.","rollback_reason":"Primary metric regressed against the retained implementation.","next_action_hint":"Retry observability through the existing hooks/logger or confirm noise before retaining; success-path import cost may be avoidable with a helper already loaded server-side."}}
{"run":9,"commit":"9130c4b","metric":135.234,"metrics":{"p95_ms":135.234,"mean_ms":74.386,"normal_p95_ms":136.618,"builtin_p95_ms":65.298,"failures":0,"requests":124},"status":"discard","description":"Eagerly started User composition index read at module evaluation","timestamp":1786770250073,"segment":0,"confidence":1.77143622722401,"asi":{"hypothesis":"Starting readdir during module evaluation would overlap index I/O with route module setup and reduce first-request latency.","observed":"The eager read did not beat the retained lazy shared promise; p95 was 16.517 ms slower than best.","rollback_reason":"Primary regression; eager side effects also make module import behavior less explicit.","next_action_hint":"Keep lazy initialization and explore reducing work for known builtin slugs or caching present override responses."}}
{"run":10,"commit":"9130c4b","metric":160.395,"metrics":{"p95_ms":160.395,"mean_ms":73.407,"normal_p95_ms":162.105,"builtin_p95_ms":68.526,"failures":0,"requests":124},"status":"discard","description":"Synchronous fast path after User composition index initialization regressed tail","timestamp":1786770298297,"segment":0,"confidence":1.9985892074368956,"asi":{"hypothesis":"Returning synchronous Set membership after the first index load would avoid Promise/await microtasks on most absent-override routes.","observed":"The more complex boolean-or-Promise API regressed p95 sharply while barely affecting mean, so microtask overhead is not the bottleneck.","rollback_reason":"Large primary regression and less clear API contract.","next_action_hint":"Do not optimize Promise mechanics; focus on actual I/O/validation or benchmark repeated user override loads."}}
{"type":"config","name":"Preset route repeated-load reliability","metricName":"load_score_ms","metricUnit":"ms","bestDirection":"lower"}
{"run":11,"commit":"af687d5","metric":89.733,"metrics":{"p95_ms":89.733,"mean_ms":68.546,"normal_p95_ms":95.742,"builtin_p95_ms":68.63,"failures":0,"requests":223},"status":"keep","description":"Repeated-load baseline across all preset routes","timestamp":1786770344744,"segment":1,"confidence":null,"asi":{"hypothesis":"A second complete pass better represents reload behavior and provides signal for safe response caching while preserving full-corpus coverage.","observed":"223 requests completed with zero failures; repeated-load baseline p95 is 89.733 ms and normal-route p95 is 95.742 ms."}}
{"run":12,"commit":"af687d5","metric":109.434,"metrics":{"p95_ms":109.434,"mean_ms":71.603,"normal_p95_ms":131.11,"builtin_p95_ms":68.074,"failures":0,"requests":223},"status":"discard","description":"Five-second parsed User override cache regressed repeated-load score","timestamp":1786770412306,"segment":1,"confidence":null,"asi":{"hypothesis":"Caching recently validated User presets and synchronizing cache entries on API mutations would make repeated reloads faster without stale GUI saves.","observed":"First-pass cache population remained enough of the workload to worsen p95, and mean also regressed; cache bookkeeping did not pay for itself across two passes.","rollback_reason":"Primary and mean regression plus added cache-coherence complexity.","next_action_hint":"Avoid parsed route cache; investigate coalescing duplicate concurrent loads or endpoint validation cost."}}
{"run":13,"commit":"af687d5","metric":120.14,"metrics":{"p95_ms":120.14,"mean_ms":70.535,"normal_p95_ms":123.702,"builtin_p95_ms":64.826,"failures":0,"requests":223},"status":"discard","description":"Noise confirmation rerun of retained repeated-load baseline","timestamp":1786770453680,"segment":1,"confidence":null,"asi":{"hypothesis":"A no-change rerun will estimate benchmark variance before judging the final optimizations.","observed":"p95 varied from 89.733 to 120.14 ms with no code change while mean moved only 1.989 ms; tail is noisy under concurrent dev-server tracing.","rollback_reason":"No code change and no primary improvement.","next_action_hint":"Favor changes with large p95 wins and corroborating mean/normal-route gains; do not keep marginal tail changes."}}
{"run":14,"commit":"af687d5","metric":133.152,"metrics":{"p95_ms":133.152,"mean_ms":71.837,"normal_p95_ms":135.856,"builtin_p95_ms":67.391,"failures":0,"requests":223},"status":"discard","description":"Fallback to builtin preset when optional User override load fails","timestamp":1786770506985,"segment":1,"confidence":null,"asi":{"hypothesis":"A corrupt or transiently unreadable User override should not take down a valid built-in `/p/<slug>` route; logging the cause and falling back improves real reliability.","observed":"Correctness passed, but the no-fault workload cannot exercise the fallback and p95/mean both regressed versus baseline.","rollback_reason":"Primary metric regressed and the reliability behavior lacks dedicated fault-injection proof.","next_action_hint":"Retry with injected override read/parse failures as part of a dedicated reliability workload; idea retained."}}
{"run":15,"commit":"af687d5","metric":90.556,"metrics":{"p95_ms":90.556,"mean_ms":69.844,"normal_p95_ms":100.369,"builtin_p95_ms":69.135,"failures":0,"requests":223},"status":"discard","description":"Final no-change confirmation of retained repeated-load behavior","timestamp":1786770539409,"segment":1,"confidence":null,"asi":{"hypothesis":"A final no-change rerun should show whether the repeated-load baseline is reproducible after the discarded fault-handling experiments.","observed":"p95 returned to within 0.823 ms of baseline with zero failures across 223 requests, confirming the large intermediate regressions were partly tail noise while mean remained stable.","rollback_reason":"No code change and no primary improvement.","next_action_hint":"Stop at the user-requested 15 total rounds; retained filename index is the only large, corroborated win."}}
{"run":16,"commit":"af687d5","metric":105.121,"metrics":{"p95_ms":105.121,"mean_ms":70.672,"normal_p95_ms":106.124,"builtin_p95_ms":71.208,"failures":0,"requests":223},"status":"discard","description":"Cached validated User-composition API wire responses for repeated route loads","timestamp":1786770639069,"segment":1,"confidence":null,"asi":{"hypothesis":"Caching only validated wire responses inside the existing User-composition API would accelerate repeated preset loads without adding cache checks to absent built-in routes; POST/PUT/DELETE kept entries coherent and a short TTL bounded manual-file staleness.","observed":"All 223 requests succeeded and checks passed, but p95 regressed 15.388 ms and mean regressed 2.126 ms versus the repeated-load baseline. Avoided second-pass file validation did not repay cache bookkeeping and first-pass cost.","rollback_reason":"Primary metric and mean both regressed; added cache coherence is not justified.","next_action_hint":"Do not cache API wire responses. The next reliability-focused attempt should use fault injection to measure atomic writes or builtin fallback directly rather than adding success-path caches."}}
{"run":17,"commit":"eb314bb","metric":89.551,"metrics":{"p95_ms":89.551,"mean_ms":68.651,"normal_p95_ms":94.123,"builtin_p95_ms":68.45,"failures":0,"requests":223},"status":"keep","description":"Made the User-composition filename index fail open to authoritative API lookup","timestamp":1786770705751,"segment":1,"confidence":0.01211798388707651,"asi":{"hypothesis":"Because the filename index is only an optimization, transient non-ENOENT readdir failures should return an unknown state and use the existing authoritative API path rather than causing every `/p/<slug>` load to fail.","observed":"All 223 routes succeeded; p95 improved slightly from 89.733 to 89.551 ms, normal-route p95 improved to 94.123 ms, and mean remained effectively flat. More importantly, the optimization no longer creates a new all-routes failure mode.","correctness":"Focused User-composition tests and full svelte-check passed. ENOENT still means an empty store, known absence still skips the API, and only unknown index state falls back to the pre-index API behavior."}}
{"run":18,"commit":"eb314bb","metric":106.025,"metrics":{"p95_ms":106.025,"mean_ms":70.044,"normal_p95_ms":109.259,"builtin_p95_ms":69.286,"failures":0,"requests":223},"status":"discard","description":"Confirmation rerun of fail-open filename index after low-confidence keep","timestamp":1786770749304,"segment":1,"confidence":0.012303948080043411,"asi":{"hypothesis":"A no-change confirmation run will determine whether the fail-open index change's tiny latency improvement was real or noise while checking that it remains performance-neutral and failure-free.","observed":"All 223 requests and correctness checks passed, but p95 rose to 106.025 ms and mean to 70.044 ms. This confirms the prior 0.2% speed improvement was noise; the retained value of eb314bb is reliability, not speed.","rollback_reason":"No new code change and no primary improvement; the previously committed fail-open behavior remains because this run only tested it.","next_action_hint":"Treat fail-open indexing as a reliability hardening with neutral/noisy performance. For another code experiment, use a dedicated fault-injection workload for atomic writes or built-in fallback rather than chasing sub-millisecond success-path changes."}}
{"type":"config","name":"Preset route concurrent autosave reliability","metricName":"load_score_ms","metricUnit":"ms","bestDirection":"lower"}
{"run":19,"commit":"ee7e9d3","metric":260338.442,"metrics":{"p95_ms":338.442,"mean_ms":96.203,"normal_p95_ms":339.137,"builtin_p95_ms":66.027,"failures":26,"operation_failures":0,"requests":255},"status":"keep","description":"Fault-stress baseline: concurrent valid autosaves exposed intermittent preset load failures","timestamp":1786770830792,"segment":2,"confidence":null,"asi":{"hypothesis":"A bounded disposable User-composition workload that overlaps valid PUT autosaves with GET route loads will reproduce the reported intermittent load failure without narrowing or weakening the full-corpus benchmark.","observed":"The broad corpus plus 32 stressed probe loads produced 26 semantic load failures, all returned as HTTP 200 error UI, while all 16 PUT operations and cleanup succeeded. This strongly supports partial/interleaved file visibility during concurrent writeFile calls as a real reliability cause.","next_action_hint":"Implement atomic temp-file publication with rename for POST/PUT and rerun the exact unchanged workload. Success means failures fall to zero without bypassing parsing, validation, or route behavior.","benchmark_integrity":"The workload still covers every preset route twice plus builtin-source samples; the disposable probe uses the same public APIs and a valid preset, and is always deleted."}}
{"run":20,"commit":"3a52eab","metric":215.644,"metrics":{"p95_ms":215.644,"mean_ms":86.231,"normal_p95_ms":215.668,"builtin_p95_ms":66.338,"failures":0,"operation_failures":0,"requests":255},"status":"keep","description":"Published User-composition writes atomically to prevent partial JSON reads","timestamp":1786770942620,"segment":2,"confidence":null,"asi":{"hypothesis":"Writing each valid User composition to a unique temporary file and atomically renaming it into place will ensure concurrent route readers observe either the previous complete JSON or the next complete JSON, never a partial/interleaved write.","observed":"Failures fell from 26 to 0 across the unchanged 255-request workload, including 32 route loads racing 16 valid autosaves. Load score improved from 260338.442 ms to 215.644 ms; p95 also fell from 338.442 to 215.644 ms and mean from 96.203 to 86.231 ms.","correctness":"Focused User-composition tests and full svelte-check passed. Temporary files use unique UUID names and are removed on write/rename failure; POST and PUT both use atomic publication.","benchmark_integrity":"The workload was unchanged from the fault-stress baseline and continued to validate every preset route twice plus builtin-source samples."}}
{"run":21,"commit":"3a52eab","metric":205.461,"metrics":{"p95_ms":205.461,"mean_ms":84.218,"normal_p95_ms":207.437,"builtin_p95_ms":66.246,"failures":0,"operation_failures":0,"requests":255},"status":"discard","description":"Confirmation rerun of atomic User-composition publication","timestamp":1786771035640,"segment":2,"confidence":25544.80978100758,"asi":{"hypothesis":"A no-change confirmation run will verify that atomic temp-file publication consistently eliminates concurrent autosave/read failures rather than benefiting from a lucky schedule.","observed":"The unchanged 255-request workload again produced zero route failures and zero write-operation failures. p95 improved further to 205.461 ms and mean to 84.218 ms; the original non-atomic baseline had 26 failures, 338.442 ms p95, and 96.203 ms mean.","rollback_reason":"No new source change was made in this confirmation iteration, so there is nothing new to retain or commit; atomic publication from 3a52eab remains retained.","next_action_hint":"The atomic-write result is now reproduced. A future code experiment should target write serialization/order semantics or fault-path Sentry issue capture, not re-test partial JSON visibility."}}
{"run":22,"commit":"3a52eab","metric":228.477,"metrics":{"p95_ms":228.477,"mean_ms":87.3,"normal_p95_ms":231.364,"builtin_p95_ms":92.594,"failures":0,"operation_failures":0,"requests":255},"status":"discard","description":"Serialized atomic User-composition writes per path to preserve request order under concurrent autosaves","timestamp":1786828909865,"segment":2,"confidence":22603.64946124436,"asi":{"hypothesis":"Serializing atomic writes per composition path would reduce concurrent filesystem contention and prevent an older autosave from publishing after a newer one, improving route-load p95 during the write/read stress phase.","rollback_reason":"Atomic publication already kept failures at zero, while per-path serialization regressed load_score_ms from the retained 215.64 ms best to 228.477 ms and added queue complexity.","next_action_hint":"Keep independent atomic writes. Pursue fault-path Sentry observability only with dedicated fault injection, or improve the broad route p95 outside persistence writes rather than serializing autosaves.","finding":"Write serialization improves ordering semantics but provides no reliability gain in this workload and worsens the measured route tail."}}
