{"run":23,"commit":"3a52eab","metric":10297.812,"metrics":{"p95_ms":297.812,"mean_ms":113.287,"normal_p95_ms":308.442,"builtin_p95_ms":85.426,"failures":1,"operation_failures":0,"requests":256},"status":"discard","description":"Fault-injection baseline: corrupt optional User override breaks its valid built-in route","timestamp":1786829001774,"segment":2,"confidence":11301.82473062218,"asi":{"hypothesis":"A dedicated corrupt-override probe will reproduce the remaining reliability gap: an unreadable optional User composition currently makes an otherwise valid built-in Preset route show load-error UI.","rollback_reason":"Baseline intentionally reproduced one semantic route failure and made no production improvement; retain only the autoresearch fault-injection workload.","next_action_hint":"Catch User override load/parse failures for slugs with a valid built-in Preset, emit bounded actionable server logging, and fall back to that built-in. Preserve load-error behavior for user-only slugs.","finding":"A truncated User override returned HTTP 200 but rendered the route load-error UI, adding the expected 10,000 ms semantic-failure penalty. The API setup and cleanup both succeeded."}}
{"run":24,"commit":"3a52eab","metric":292.664,"metrics":{"p95_ms":292.664,"mean_ms":100.489,"normal_p95_ms":294.313,"builtin_p95_ms":72.763,"failures":0,"operation_failures":0,"requests":256},"status":"checks_failed","description":"Fallback to built-in Preset when an optional User override is corrupt or unreadable","timestamp":1786829094691,"segment":2,"confidence":5200.583749850057,"asi":{"hypothesis":"If an optional User override cannot be read or parsed, logging the bounded failure and falling back to an existing built-in Preset will keep the route usable while preserving errors for user-only slugs.","rollback_reason":"The fault probe improved from one semantic failure to zero, but correctness checks could not start because node_modules/vitest/vitest.mjs is missing. A checks_failed result cannot be retained.","next_action_hint":"Repair the local pnpm/node_modules links without changing application behavior, then rerun the same fallback implementation and unchanged fault-injection workload.","finding":"The production behavior eliminated the injected corrupt-override failure, but validation infrastructure is currently broken independently of the code change.","check_error":"Cannot find module node_modules/vitest/vitest.mjs"}}
{"run":25,"commit":"3a52eab","metric":214.657,"metrics":{"p95_ms":214.657,"mean_ms":84.322,"normal_p95_ms":216.555,"builtin_p95_ms":77.407,"failures":0,"operation_failures":0,"requests":256},"status":"checks_failed","description":"Retried corrupt-override fallback after repairing package links","timestamp":1786829176237,"segment":2,"confidence":11301.82473062218,"asi":{"hypothesis":"After repairing the stale top-level Vitest link, the built-in fallback should eliminate the injected corrupt-override failure and pass correctness checks.","rollback_reason":"The behavior again eliminated all failures and reached 214.657 ms, but pnpm's failed offline sharp install did not recreate node_modules/.bin/vitest, so checks still could not start.","next_action_hint":"Repair node_modules/.bin command links (or complete a script-ignored offline install), verify pnpm exec vitest starts, then rerun the identical fallback and workload.","finding":"Fallback performance and reliability are reproducible, but this run remains unretainable solely because the package-manager command shim is missing.","check_error":"sh: vitest: command not found"}}
{"run":26,"commit":"fe7de7a","metric":252.692,"metrics":{"p95_ms":252.692,"mean_ms":87.515,"normal_p95_ms":255.519,"builtin_p95_ms":72.215,"failures":0,"operation_failures":0,"requests":256},"status":"keep","description":"Fallback to built-in Preset when an optional User override is corrupt or unreadable","timestamp":1786829256767,"segment":2,"confidence":8521.491801936092,"asi":{"hypothesis":"When an optional User override cannot be read or parsed, logging the bounded failure and falling back to an existing built-in Preset will eliminate the reproduced semantic route failure while preserving errors for user-only slugs.","finding":"The unchanged fault-injection workload improved from one semantic failure and a 10,297.812 ms score to zero failures and 252.692 ms. Focused route tests verify built-in fallback, user precedence, source=builtin bypass, missing routes, and continued error behavior for user-only slugs.","validation":"Benchmark and full autoresearch checks passed after repairing local pnpm command links.","next_action_hint":"Confirm the retained fallback once under the unchanged fault workload, then target actionable structured Sentry context for this graceful recovery without adding success-path imports."}}
{"run":27,"commit":"fe7de7a","metric":242.333,"metrics":{"p95_ms":242.333,"mean_ms":86.229,"normal_p95_ms":243.863,"builtin_p95_ms":66.83,"failures":0,"operation_failures":0,"requests":256},"status":"discard","description":"Confirmation run of retained corrupt-override built-in fallback","timestamp":1786829347492,"segment":2,"confidence":9398.858144240501,"asi":{"hypothesis":"A no-change confirmation under the unchanged corrupt-override workload will verify that the retained built-in fallback consistently eliminates semantic route failures and remains performance-neutral.","rollback_reason":"No source change was made in this confirmation iteration, so there is nothing new to retain; commit fe7de7a remains the retained implementation.","next_action_hint":"The fallback is reproduced with zero failures. Next target actionable structured Sentry context for graceful fallback without introducing a success-path import, or stop if observability cannot be measured without distorting the workload.","finding":"The second checks-passing run again produced zero failures, with 242.333 ms load score versus 252.692 ms in the retained run. Full checks passed."}}
{"run":28,"commit":"fe7de7a","metric":285.584,"metrics":{"p95_ms":285.584,"mean_ms":95.272,"normal_p95_ms":287.133,"builtin_p95_ms":69.826,"failures":0,"operation_failures":0,"requests":256},"status":"discard","description":"Lazy explicit Sentry issue capture for corrupt-override fallback","timestamp":1786829433660,"segment":2,"confidence":7334.944323036362,"asi":{"hypothesis":"Dynamically importing Sentry only on the corrupt-override recovery path would create an actionable exception issue with bounded route tags while leaving normal route loads unaffected.","rollback_reason":"Failures remained at zero, but load_score_ms regressed from the retained 252.692 ms run and 242.333 ms confirmation to 285.584 ms. Explicit capture is not justified by the primary metric.","next_action_hint":"Rely on the existing server consoleLoggingIntegration for the bounded fallback log, or add structured context centrally in hooks.server.ts only if a dedicated observability assertion can prove value without adding route-path latency.","finding":"Even fault-only awaited Sentry loading correlated with a broader p95 and mean regression; avoid route-local SDK imports."}}
{"run":29,"commit":"1ffcab2","metric":238.771,"metrics":{"p95_ms":238.771,"mean_ms":86.758,"normal_p95_ms":239.54,"builtin_p95_ms":68.529,"failures":0,"operation_failures":0,"requests":256},"status":"keep","description":"Coalesced concurrent GET reads for the same User composition","timestamp":1786829547980,"segment":2,"confidence":9398.858144240501,"asi":{"hypothesis":"Sharing only simultaneously in-flight reads and validation for the same User-composition slug will reduce filesystem and schema-validation contention during concurrent autosave reloads without caching responses beyond request completion.","finding":"The unchanged workload remained failure-free and improved load_score_ms from the retained 252.692 ms to 238.771 ms; mean also improved from 87.515 ms to 86.758 ms. A focused test proves same-slug requests share one read while the in-flight entry is removed after completion.","validation":"Benchmark and full autoresearch checks passed.","next_action_hint":"Run a no-change confirmation because the p95 improvement over the immediately preceding 242.333 ms confirmation is modest. Retain only if failure-free behavior and tail latency reproduce."}}
{"run":30,"commit":"1ffcab2","metric":265.36,"metrics":{"p95_ms":265.36,"mean_ms":95.936,"normal_p95_ms":292.616,"builtin_p95_ms":67.508,"failures":0,"operation_failures":0,"requests":256},"status":"discard","description":"Confirmation run of in-flight User-composition read coalescing","timestamp":1786829590594,"segment":2,"confidence":8037.908596502076,"asi":{"hypothesis":"A no-change confirmation will determine whether the modest tail improvement from same-slug in-flight read coalescing is reproducible.","rollback_reason":"No source change was made, and the confirmation regressed from 238.771 ms to 265.360 ms with a worse mean. The retained coalescing result is not performance-confirmed.","next_action_hint":"Run an explicit removal experiment for in-flight coalescing under the unchanged workload. If removal matches or beats this result, drop the added concurrency complexity; otherwise treat performance as noisy and judge it only on concurrency semantics.","finding":"Failures remained zero, but the p95 improvement did not reproduce."}}
{"run":31,"commit":"1ffcab2","metric":272.108,"metrics":{"p95_ms":272.108,"mean_ms":95.922,"normal_p95_ms":273.578,"builtin_p95_ms":68.469,"failures":0,"operation_failures":0,"requests":256},"status":"discard","description":"Removed in-flight User-composition read coalescing to test whether complexity was justified","timestamp":1786829662879,"segment":2,"confidence":7908.391037334308,"asi":{"hypothesis":"If the coalescing win was benchmark noise, removing it should match or improve the unchanged workload while simplifying request semantics.","rollback_reason":"Removal regressed load_score_ms to 272.108 ms, worse than both the retained 238.771 ms result and its 265.360 ms confirmation, with no mean improvement. Keep coalescing.","next_action_hint":"Retain bounded in-flight coalescing. For the remaining rounds, avoid more persistence micro-optimizations; use no-change stability runs or stop after the configured round limit.","finding":"Neither direction produced a large stable p95 separation, but removal offered no performance or reliability benefit and discarded a legitimate reduction in duplicate concurrent work."}}
{"run":32,"commit":"1ffcab2","metric":223.933,"metrics":{"p95_ms":223.933,"mean_ms":83.558,"normal_p95_ms":225.084,"builtin_p95_ms":68.907,"failures":0,"operation_failures":0,"requests":256},"status":"discard","description":"No-change stability run of retained fallback and in-flight read coalescing","timestamp":1786829703267,"segment":2,"confidence":9213.757367526212,"asi":{"hypothesis":"A further no-change run will characterize noise after the removal experiment and verify that the retained fallback plus bounded coalescing remains failure-free.","rollback_reason":"No source change was made, so there is nothing new to retain or commit; retained commits fe7de7a and 1ffcab2 remain unchanged.","next_action_hint":"One configured round remains. Use a final no-change run to close with reliability evidence rather than adding another low-confidence micro-optimization.","finding":"The workload again produced zero failures, with 223.933 ms p95 and improved mean, confirming that recent p95 movement is largely environmental while reliability remains stable."}}
{"run":33,"commit":"1ffcab2","metric":213.704,"metrics":{"p95_ms":213.704,"mean_ms":82.727,"normal_p95_ms":215.28,"builtin_p95_ms":70.644,"failures":0,"operation_failures":0,"requests":256},"status":"discard","description":"Final no-change reliability confirmation for preset routes under autosave and corrupt-override stress","timestamp":1786829740230,"segment":2,"confidence":9398.858144240501,"asi":{"hypothesis":"A final unchanged run will close the configured experiment budget with evidence that atomic publication, corrupt-override fallback, and bounded in-flight reads remain failure-free across the full preset corpus.","rollback_reason":"No source change was made in this confirmation iteration, so there is nothing new to retain; the retained implementation remains in commits 3a52eab, fe7de7a, and 1ffcab2.","next_action_hint":"Stop the autoresearch loop at the configured 15-round segment limit. Review and integrate the retained commits; do not add more benchmark-driven micro-optimizations.","finding":"Final workload completed with zero route or operation failures, 213.704 ms p95, and 82.727 ms mean. Full checks passed."}}
