{"type":"config","name":"Homepage visual readiness","metricName":"visualReadyMs","metricUnit":"ms","bestDirection":"lower"}
{"run":1,"commit":"362c48d","metric":1538.44,"metrics":{"ttfb":43.8,"domContentLoaded":60.6,"loadEvent":92,"lcp":1524,"apiRequests":46,"responseKb":18687.03},"status":"keep","description":"Baseline cold-cache homepage visual readiness","timestamp":1786758764016,"segment":0,"confidence":null,"asi":{"hypothesis":"The baseline will confirm that client-side N+1 user-composition requests and poster transfers dominate visual readiness.","finding":"The homepage issued 46 user-composition API requests and transferred 18.2 MB before visual readiness; LCP nearly equals visualReadyMs, while initial HTML and hydration finished under 100 ms.","next_action_hint":"Return card-ready metadata in the list response so the homepage does not fetch 45 full Presets individually."}}
{"run":2,"commit":"3bcaad2","metric":1339.41,"metrics":{"ttfb":52,"domContentLoaded":109.2,"loadEvent":119.2,"lcp":1324,"apiRequests":1,"responseKb":18586.23},"status":"keep","description":"Eliminate homepage N+1 full-Preset fetches by returning card metadata in the local list response","timestamp":1786758939958,"segment":0,"confidence":null,"asi":{"hypothesis":"Deriving poster key, duration, and surface type while the local server already parses each composition will remove 45 redundant browser requests and reduce client work without caching changing Presets.","finding":"User-composition requests fell from 46 to 1 and visual readiness improved by 199 ms (12.9%). The 18.1 MB transfer remains almost entirely poster imagery, and LCP still determines readiness.","user_constraint":"Presets are frequently changing local data; hard caching and hardcoded metadata are not acceptable. Continue targeting JavaScript, Svelte rendering, and request scheduling.","next_action_hint":"Profile why the browser transfers roughly the entire 15 MB poster corpus on the initial viewport despite lazy loading; fix Svelte/DOM image scheduling rather than caching data."}}
{"run":3,"commit":"pending","metric":1382.18,"metrics":{"ttfb":41.6,"domContentLoaded":56.8,"loadEvent":85.6,"lcp":1296,"apiRequests":1,"responseKb":18449.08},"status":"discard","description":"Gate poster image creation with a near-viewport IntersectionObserver attachment","timestamp":1786759066954,"segment":0,"confidence":4.653495440729484,"asi":{"hypothesis":"Explicitly mounting only near-viewport images will avoid native lazy-loading's broad preload distance and reduce contention from the dense grid.","finding":"LCP improved by 28 ms versus the current best, but overall visual readiness regressed by 43 ms and transfer size barely changed. Chrome still requested nearly the full poster corpus, likely because the first 45-card user section remains within the observer scheduling/layout window or because readiness/network accounting captures subsequent observer intersections.","rollback_reason":"Primary metric worsened by 3.2% versus the current best; added observer complexity did not materially reduce transferred bytes.","next_action_hint":"Profile request initiators and poster dimensions/count rather than adding another lazy-load layer. Investigate duplicate full-resolution poster decodes and whether responsive thumbnail generation is the actual bottleneck."}}
{"run":4,"commit":"pending","metric":1268.84,"metrics":{"ttfb":34,"domContentLoaded":48.7,"loadEvent":75.9,"lcp":1264,"apiRequests":1,"posterRequests":45,"posterKb":540.01,"scriptKb":6286.92,"presetKb":1124.99,"responseKb":18587.69},"status":"checks_failed","description":"Defer poster alpha-crop scans until browser idle so decoded images can paint first","timestamp":1786759220911,"segment":0,"confidence":3.5120875242632734,"asi":{"hypothesis":"Synchronous per-image alpha scans in load handlers delay Svelte's ready-state paint during a burst of local poster decodes.","finding":"The benchmark improved another 70 ms versus the current best and showed only 540 KB of poster data; 18.6 MB total is mostly dev-server script/module overhead. Correctness checks failed without surfaced output because checks.sh suppresses stdout, so the promising change was reverted.","rollback_reason":"Required npm check failed; a benchmark improvement cannot be kept with failed checks.","next_action_hint":"Reapply the idle crop change, run npm check directly to expose and fix the type/compiler error, then rerun. Improve checks.sh so failure output is visible."}}
{"run":5,"commit":"56396ff","metric":1291.24,"metrics":{"ttfb":37.1,"domContentLoaded":52.9,"loadEvent":80.4,"lcp":1044,"apiRequests":1,"posterRequests":45,"posterKb":540.01,"scriptKb":6286.93,"presetKb":1124.99,"responseKb":18587.7},"status":"keep","description":"Move non-critical poster alpha-crop scans out of image load handlers and into browser idle time","timestamp":1786759349706,"segment":0,"confidence":5.131824787211951,"asi":{"hypothesis":"Synchronous alpha-crop work in each image load handler blocks Svelte ready-state paints even though the decoded poster is already usable.","finding":"Deferring crop refinement improved visual readiness by 48 ms versus the current best and improved LCP by 280 ms. Poster traffic is only 45 requests/540 KB; cold dev-server JavaScript/module traffic is the larger remaining cost.","next_action_hint":"Reduce homepage client module graph. The page imports the full preset engine module, eagerly validates 99 JSON files, and pulls editor/runtime dependencies just to render the library."}}
{"run":6,"commit":"3ee85ca","metric":933.34,"metrics":{"ttfb":34.9,"domContentLoaded":49.5,"loadEvent":76.5,"lcp":928,"apiRequests":1,"posterRequests":45,"posterKb":540.01,"scriptKb":1856.41,"presetKb":0,"responseKb":10945.93},"status":"keep","description":"Render the dynamic Preset catalog from server-derived card metadata and lazy-load editor-only modules on user actions","timestamp":1786759620705,"segment":0,"confidence":10.677607199576482,"asi":{"hypothesis":"The homepage should not import and validate the full frequently changing Preset corpus or editor/runtime modules merely to render card labels and thumbnails.","finding":"Visual readiness improved by 358 ms versus the current best and 605 ms versus baseline. Initial script traffic fell from 6.29 MB to 1.86 MB, preset module traffic fell from 1.12 MB to zero, and total cold dev-server traffic fell by 7.6 MB. Metadata remains derived from live Presets on every server module refresh; nothing is hardcoded or persistently cached.","next_action_hint":"Remove the remaining post-mount user-composition list fetch by including server-derived user card metadata in page data, so user cards and poster requests can begin in SSR without a second render."}}
{"run":7,"commit":"pending","metric":1060.69,"metrics":{"ttfb":73.2,"domContentLoaded":128.9,"loadEvent":131.3,"lcp":904,"apiRequests":0,"posterRequests":26,"posterKb":319.05,"scriptKb":1850.69,"presetKb":0,"responseKb":10778.09},"status":"discard","description":"Move user-composition card metadata into homepage SSR through a shared server catalog","timestamp":1786759827856,"segment":0,"confidence":6.6538376951836335,"asi":{"hypothesis":"Server-rendering user cards will remove the post-mount list request and let visible posters begin sooner.","finding":"The API request disappeared, LCP improved 24 ms, and only 26 posters were requested, but sequentially reading, validating, and inspecting 45 user compositions increased TTFB by 38 ms and overall visual readiness regressed 127 ms.","rollback_reason":"Primary metric worsened 13.6% versus the current best. Moving existing sequential work onto the critical server path was counterproductive.","next_action_hint":"If revisiting SSR user cards, first make server catalog reads concurrent and provide a card-only lane that does not perform media inspection unused by the homepage. Otherwise keep the client request off the initial critical path."}}
{"run":8,"commit":"pending","metric":1062.62,"metrics":{"ttfb":85.7,"domContentLoaded":136.8,"loadEvent":146.5,"lcp":1028,"apiRequests":1,"posterRequests":45,"posterKb":540.01,"scriptKb":1856.41,"presetKb":0,"responseKb":10945.93},"status":"discard","description":"Read and inspect local user-composition metadata concurrently in the collection endpoint","timestamp":1786759960109,"segment":0,"confidence":3.7870822380773546,"asi":{"hypothesis":"Parallel local file reads and media inspections will shorten the post-mount user-composition request.","finding":"The run regressed 129 ms, driven by unrelated-looking initial navigation TTFB growth from 35 ms to 86 ms; API request count and payload were unchanged. Concurrency did not produce a measurable end-to-end win under the primary workload.","rollback_reason":"Primary metric worsened 13.9% versus the current best; do not retain concurrency solely on an unproven micro-optimization.","next_action_hint":"Focus on initial render and image priority. Add phase signal for the user-composition response before retrying server endpoint changes."}}
{"run":9,"commit":"pending","metric":1814.08,"metrics":{"ttfb":90.9,"domContentLoaded":140.2,"loadEvent":284.4,"lcp":1756,"apiRequests":1,"posterRequests":45,"posterKb":540.01,"scriptKb":1856.2,"presetKb":0,"responseKb":10866.84},"status":"checks_failed","description":"Replace non-reactive poster crop cache SvelteMap with a plain Map","timestamp":1786760106469,"segment":0,"confidence":2.6467500656110565,"asi":{"hypothesis":"The module cache has no reactive consumers, so a plain Map may avoid unnecessary Svelte invalidation overhead during image-load bursts.","finding":"ESLint requires SvelteMap for mutable Maps in components, and the benchmark was substantially worse. The run also had unusually high TTFB/load timing, but there is no evidence this change helps.","rollback_reason":"Correctness checks failed on svelte/prefer-svelte-reactivity and primary metric regressed.","next_action_hint":"Keep SvelteMap to satisfy project lint. Profile reactive invalidation with tooling before challenging the rule."}}
{"run":10,"commit":"c613b25","metric":810.1,"metrics":{"ttfb":34.8,"domContentLoaded":51.9,"loadEvent":81.8,"lcp":796,"userApiEnd":379.1,"apiRequests":1,"posterRequests":45,"posterKb":540.01,"scriptKb":1856.41,"presetKb":0,"responseKb":10945.93},"status":"keep","description":"Add user-composition response timing and confirm the optimized homepage on a repeated cold-browser run","timestamp":1786760205053,"segment":0,"confidence":3.3351191702726837,"asi":{"hypothesis":"A repeated run with explicit API response timing will separate dev-server variance from user-composition and poster phases.","finding":"Unchanged product code measured 810 ms, 123 ms faster than the prior keep, confirming substantial warm dev-server variance. User metadata finished at 379 ms; visible poster/LCP completion followed about 417 ms later. Treat small future differences cautiously and target structural changes larger than this noise.","next_action_hint":"Optimize the 379–796 ms image/decode/render phase. Test removing the decorative 300 ms opacity fade, which may delay LCP without helping skeleton readiness."}}
{"run":11,"commit":"pending","metric":811.7,"metrics":{"ttfb":39.1,"domContentLoaded":54.9,"loadEvent":83.1,"lcp":568,"userApiEnd":429.7,"apiRequests":1,"posterRequests":23,"posterKb":308.15,"scriptKb":1858.25,"presetKb":0,"responseKb":10708.74},"status":"discard","description":"Mount poster images only when their previews intersect the viewport","timestamp":1786760317726,"segment":0,"confidence":3.4991112178717296,"asi":{"hypothesis":"A zero-margin IntersectionObserver will prevent native lazy loading from prefetching off-screen rows while preserving dynamic poster behavior.","finding":"Poster requests fell from 45 to 23, poster bytes fell 43%, and LCP improved 228 ms, but the primary metric was 1.6 ms worse than the current best—well within observed dev-server noise.","rollback_reason":"Primary metric did not improve, and the added attachment should not be kept based only on secondary metrics without confirmation.","next_action_hint":"Repeat the exact candidate once as advised for a within-noise result; keep only if primary improvement confirms while request/LCP gains persist."}}
{"run":12,"commit":"2b7506e","metric":758.08,"metrics":{"ttfb":52.7,"domContentLoaded":69.1,"loadEvent":101.8,"lcp":500,"userApiEnd":366.2,"apiRequests":1,"posterRequests":14,"posterKb":195.8,"scriptKb":1858.25,"presetKb":0,"responseKb":10596.4},"status":"keep","description":"Load dynamic posters only when their card previews actually enter the viewport","timestamp":1786760406537,"segment":0,"confidence":3.4772301933873986,"asi":{"hypothesis":"Repeating the zero-margin viewport attachment will confirm whether its near-neutral first primary result was noise while preserving large LCP/request reductions.","finding":"Confirmed: visual readiness improved 52 ms versus the current best, LCP improved another 296 ms, poster requests fell from 45 to 14, and poster bytes fell 64%. Off-screen dynamic posters still load when scrolled into view; no content or cache is hardcoded.","next_action_hint":"The user-composition response now ends around 366 ms and LCP around 500 ms. Investigate whether returning a card-only response can reduce API parse/media inspection without moving work into TTFB."}}
{"run":13,"commit":"602efe8","metric":741.48,"metrics":{"ttfb":41.9,"domContentLoaded":84.5,"loadEvent":87.9,"lcp":476,"userApiEnd":349.8,"apiRequests":1,"posterRequests":14,"posterKb":195.8,"scriptKb":1858.27,"presetKb":0,"responseKb":10593.06},"status":"keep","description":"Add a card-only user-composition response that skips media inspection unused by the homepage","timestamp":1786760542202,"segment":0,"confidence":3.1560272453667055,"asi":{"hypothesis":"The homepage card lane can preserve schema and semantic validation while skipping media filesystem inspection and response fields it never reads.","finding":"Visual readiness improved 16.6 ms, API response end improved 16.4 ms, and LCP improved 24 ms. The card response remains derived from each current local Preset and validates it; this is not caching or hardcoding.","next_action_hint":"Add focused coverage for the card view contract, then test whether the remaining 300 ms image opacity transition affects perceived readiness or only LCP."}}
{"run":14,"commit":"pending","metric":744.22,"metrics":{"ttfb":42.6,"domContentLoaded":56.5,"loadEvent":83.8,"lcp":484,"userApiEnd":350.3,"apiRequests":1,"posterRequests":23,"posterKb":308.15,"scriptKb":1858.33,"presetKb":0,"responseKb":10705.46},"status":"discard","description":"Mark observer-confirmed visible posters as high fetch priority","timestamp":1786760629509,"segment":0,"confidence":3.011316619750241,"asi":{"hypothesis":"Once IntersectionObserver confirms a poster is visible, high fetch priority may finish its local request and decode sooner.","finding":"Primary metric regressed 2.7 ms and LCP regressed 8 ms; the run also requested 23 rather than 14 posters, suggesting priority provided no stable scheduling benefit.","rollback_reason":"No primary improvement and no secondary evidence of benefit.","next_action_hint":"Leave browser priority automatic. Use the final iteration for focused contract coverage and a confirmation run of the kept state."}}
{"run":15,"commit":"9eee28c","metric":723.42,"metrics":{"ttfb":36.4,"domContentLoaded":52.2,"loadEvent":78.6,"lcp":468,"userApiEnd":327.7,"apiRequests":1,"posterRequests":23,"posterKb":308.15,"scriptKb":1858.33,"presetKb":0,"responseKb":10705.45},"status":"keep","description":"Decode visible poster images asynchronously","timestamp":1786760720750,"segment":0,"confidence":2.9241532721010333,"asi":{"hypothesis":"Explicit asynchronous decoding will keep visible poster decodes from blocking the main thread during Svelte's user-card insertion.","finding":"Visual readiness improved 18 ms versus the current best and LCP improved 8 ms. User API timing also varied lower, so the gain is modest but the primary metric improved with all checks passing.","next_action_hint":"Stop at the user-requested 15-run cap. Add focused card-view contract coverage during normal follow-up rather than another optimization experiment."}}
{"run":16,"commit":"pending","metric":1622.44,"metrics":{"ttfb":93.9,"domContentLoaded":442.9,"loadEvent":457.8,"lcp":1484,"userApiEnd":319.1,"apiRequests":1,"posterRequests":14,"posterKb":195.8,"scriptKb":1858.76,"presetKb":0,"responseKb":10593.71},"status":"discard","description":"Preload the dynamic user-composition card response from homepage HTML","timestamp":1786761020164,"segment":0,"confidence":2.8039839677979805,"asi":{"hypothesis":"Starting the same dynamic card-response fetch from the HTML head will overlap local Preset parsing with hydration and reduce the post-mount wait without caching or hardcoding data.","finding":"The card response ended only 9 ms earlier, while DOMContentLoaded regressed by about 390 ms and visual readiness regressed by 899 ms. Preloading the CPU-heavy local endpoint competed with critical dev-server module transformation and hydration rather than creating useful overlap.","rollback_reason":"Primary metric more than doubled; eager preload moved non-critical local parsing onto the critical path.","next_action_hint":"Keep user-composition loading after mount. Future work should reduce endpoint CPU cost or use true server streaming, not raise its network priority."}}
{"run":17,"commit":"pending","metric":746.82,"metrics":{"ttfb":50.7,"domContentLoaded":85.7,"loadEvent":97.7,"lcp":508,"userApiEnd":337,"apiRequests":1,"posterRequests":23,"posterKb":308.15,"scriptKb":1858.33,"presetKb":0,"responseKb":10705.45},"status":"discard","description":"Read and validate local user compositions concurrently for the card endpoint","timestamp":1786761153512,"segment":0,"confidence":2.693301609332144,"asi":{"hypothesis":"Parallel filesystem reads will reduce the card endpoint's response time while retaining full schema and semantic validation of frequently changing local Presets.","finding":"The user-composition response ended 9 ms later than the current best, LCP regressed 40 ms, and visual readiness regressed 23 ms. Concurrent reads did not help because validation and hashing remain CPU-bound on the single JavaScript thread, while extra promise scheduling added overhead.","rollback_reason":"Primary metric worsened 3.2% and the endpoint-specific timing also regressed.","next_action_hint":"Keep sequential reads. A meaningful endpoint improvement requires reducing repeated CPU validation/hashing work through an invalidation-safe design, not parallelizing local I/O."}}
{"run":18,"commit":"pending","metric":763.75,"metrics":{"ttfb":42.5,"domContentLoaded":68.6,"loadEvent":86.6,"lcp":508,"userApiEnd":386.4,"apiRequests":1,"posterRequests":21,"posterKb":298.72,"scriptKb":1858.11,"presetKb":0,"responseKb":10344.85},"status":"discard","description":"Load Graffiti only on the workspace route instead of the homepage layout","timestamp":1786761281659,"segment":0,"confidence":3.206657092833395,"asi":{"hypothesis":"The homepage fully restyles its controls and should not load the workspace-oriented Graffiti package globally; route-scoping it may shrink cold dev-server work without changing workspace behavior.","finding":"Total response traffic fell by about 361 KB, confirming Graffiti contributed avoidable homepage bytes, but visual readiness regressed 40 ms, LCP regressed 40 ms, and the user API completed 59 ms later. The byte reduction did not translate into the primary metric under this workload.","rollback_reason":"Primary metric worsened 5.6%; do not retain a dependency-boundary refactor based only on transferred bytes.","next_action_hint":"Profile the client main-thread timeline or endpoint CPU directly before another structural change. Remaining differences are now close to dev-server variance."}}
{"run":19,"commit":"1e3b73d","metric":713.35,"metrics":{"ttfb":36,"domContentLoaded":53.9,"loadEvent":81.3,"lcp":496,"userApiEnd":328.7,"apiRequests":1,"posterRequests":23,"posterKb":308.15,"scriptKb":1858.29,"presetKb":0,"responseKb":10705.48},"status":"keep","description":"Remove redundant native lazy loading after the viewport observer mounts a poster","timestamp":1786761409182,"segment":0,"confidence":4.300479516313978,"asi":{"hypothesis":"The zero-margin IntersectionObserver already prevents off-screen image creation, so native loading=\"lazy\" adds a second scheduler delay to images known to be visible.","finding":"Visual readiness improved 10 ms versus the current best with unchanged API and transfer characteristics. LCP varied 28 ms worse, so the gain is modest, but the primary metric improved and the code is simpler: the observer now solely owns deferred loading.","next_action_hint":"Confirm the small gain on a repeat before building further on it; observed dev-server noise is of similar magnitude."}}
