{"run":37,"commit":"pending","metric":733.65,"metrics":{"ttfb":49.4,"domContentLoaded":94.6,"loadEvent":95.3,"lcp":516,"userApiEnd":351.1,"apiRequests":1,"posterRequests":22,"posterKb":302.48,"surfacePosterRequests":2,"surfacePosterKb":5.43,"compositionPosterRequests":20,"compositionPosterKb":297.05,"posterLastEndMs":428.04,"posterMaxDurationMs":36.68,"scriptKb":1858.32,"presetKb":0,"responseKb":10699.84},"status":"discard","description":"Instrument poster completion timing on the kept homepage","timestamp":1786763835026,"segment":0,"confidence":32.793720190778906,"asi":{"hypothesis":"Request-level poster timing will show whether one unusually slow image or the aggregate request wave determines the 300 ms network-idle tail.","finding":"The final poster completed at 428 ms, while the slowest individual poster took only 36.7 ms. The card API ended at 351 ms, leaving a 77 ms post-API poster wave before the fixed 300 ms idle window. No single large/slow poster dominates; scheduling roughly 20 useful composition requests after layout insertion determines the tail.","rollback_reason":"No product change was tested and the unchanged primary value did not beat the current best.","next_action_hint":"Target layout-stabilization waste: avoid starting built-in template posters that are immediately pushed off-screen when user cards arrive, without reducing visible final previews."}}
